objectid,filename,title,format,interpretation,creator,findingaid,date,date_expanded,category,subject,url,speaker,pageref,citedtext,rights,rightsstatement
1,monody.jpeg,To the Memory of a Lady Lately Deceased: A Monody,image/jpeg,"Given the title of the novel, Belinda, and the characteristics outlined here making up the majority of her character construction, this preface powerfully establishes Edgeworth's desire to showcase the kind of romantic prudence she deemed essential to successful English love matches. Also of note, that in Lyttleton's poem he does distinguish his deceased wife Lucy's charms as being specifically virtuous and distinctly English (as compared to Italy and France), so there is something to be said regarding Edgeworth's larger claims of the height of civility and its association with English culture superceding that of other nations.",Lord George Lyttleton,"This excerpt can be found in part XII, at the bottom page nine of the primary source document.",1747,1747,Poetry,Domestic Life; Matrimony; Moral,https://bc.primo.exlibrisgroup.com/permalink/01BC_INST/1nm9l4s/alma99118070440001021,Lord George Lyttleton,1,"Preface: ""A prudence undeceiving, undeceived, / That nor too little, nor too much believed; / That scorned unjust Suspicion's coward fear, / and without weakness knew to be sincere",,
2,moraltales.jpeg,Contes Moraux (Moral Tales),image/jpeg,"Originally a writer for comedy, Marmontel began this series with some initial essays written with fallacious, overdetermined foundational premises, each different but based in contemporary social observations or sayings that were often taken for granted. Over time, these amassed into a large collection of instructive tales, in which he complicated the initial impressions/assumptions people make through the lives of each character drawn. Edgeworth makes numerous and explicit references to this story collection, and it can be seen in a sizable influence to her writing style, where it can sometimes approach a didactic element; however, she also does take up a similar project of plumbing the depths of social questions and constructing characters that do the work of demanding a more nuanced evaluation of things like London society life, marriage, and perspectives on the globalized world (France, the West Indies, etc).",Jean-Francois Marmontel,The link provided offers a digitized copy of the primary source.,1764,1764-1766,Story Collection,Literary Culture; Moral; Translation; Comedy; Global Literature,https://bc.primo.exlibrisgroup.com/permalink/01BC_INST/1nm9l4s/alma99119034500001021,Maria Edgeworth,3,"""The following work is offered to the public as a Moral Tale--the author not wishing to acknowledge a Novel.""",,
3,caroline.jpeg,Caroline de Litchfield,image/jpeg,"This author is also known by her married name, Isabelle de Montolieu. She is identified here among the authors Edgeworth admired because of their tendency to write novels that were in some way either instructive or emulative of elevated virtue/morality.",Isabelle Polier de Bottens,The link provided offers a digitized copy of the primary source.,1786,1786,Novel,Authorship; Contemporary Works; Moral,https://hdl.handle.net/2027/nyp.33433075797716,Maria Edgeworth,3,"""Were all novels like those of madame de Crousaz, Mrs. Inchbald, miss Burney, or Dr.Moore, she would adopt the name of novel with delight: But so much folly, errour, and vice are disseminated in books classed under this denomination, that it is hoped the wish to assume another title will be attributed to feelings that are laudable, and not fastidious.""",,
4,inchbald.jpeg,A Simple Story,image/jpeg,"A novel and author admired by Edgeworth, and from whom she drew inspiration. She is identified here among the authors Edgeworth admired because of their tendency to write novels that were in some way either instructive or emulative of elevated virtue/morality.",Elizabeth Inchbald,The link provided offers a digitized copy of the primary source.,1791,1791,Novel,Authorship; Contemporary Works; Moral,https://bc.primo.exlibrisgroup.com/permalink/01BC_INST/1nm9l4s/alma99110287970001021,Maria Edgeworth,3,"""Were all novels like those of madame de Crousaz, Mrs. Inchbald, miss Burney, or Dr.Moore, she would adopt the name of novel with delight: But so much folly, errour, and vice are disseminated in books classed under this denomination, that it is hoped the wish to assume another title will be attributed to feelings that are laudable, and not fastidious.""",,
5,evelina.jpeg,Evelina,image/jpeg,"Edgeworth was a subscriber of Burney's works, and likely drew inspiration from her. She is identified here among the authors Edgeworth admired because of their tendency to write novels that were in some way either instructive or emulative of elevated virtue/morality.",Frances Burney,The link provided offers a digitized copy of the primary source.,1778,1778,Novel,Authorship; Contemporary Works; Moral,https://bc.primo.exlibrisgroup.com/permalink/01BC_INST/1nm9l4s/alma99111216820001021,Maria Edgeworth,3,"""Were all novels like those of madame de Crousaz, Mrs. Inchbald, miss Burney, or Dr.Moore, she would adopt the name of novel with delight: But so much folly, errour, and vice are disseminated in books classed under this denomination, that it is hoped the wish to assume another title will be attributed to feelings that are laudable, and not fastidious.""",,
6,cecilia.jpeg,Cecilia,image/jpeg,"Edgeworth was a subscriber of Burney's works, and likely drew inspiration from her. She is identified here among the authors Edgeworth admired because of their tendency to write novels that were in some way either instructive or emulative of elevated virtue/morality.",Frances Burney,The link provided offers a digitized copy of the primary source.,1782,1782,Novel,Authorship; Contemporary Works; Moral,https://bc.primo.exlibrisgroup.com/permalink/01BC_INST/1nm9l4s/alma99123377000001021,Maria Edgeworth,3,"""Were all novels like those of madame de Crousaz, Mrs. Inchbald, miss Burney, or Dr.Moore, she would adopt the name of novel with delight: But so much folly, errour, and vice are disseminated in books classed under this denomination, that it is hoped the wish to assume another title will be attributed to feelings that are laudable, and not fastidious.""",,
7,camilla.jpeg,Camilla,image/jpeg,"Edgeworth was a subscriber of Burney's works, and likely drew inspiration from her. She is identified here among the authors Edgeworth admired because of their tendency to write novels that were in some way either instructive or emulative of elevated virtue/morality.",Frances Burney,The link provided offers a digitized copy of the primary source.,1796,1796,Novel,Authorship; Contemporary Works; Moral,https://bc.primo.exlibrisgroup.com/permalink/01BC_INST/1nm9l4s/alma99114249080001021,Maria Edgeworth,3,"""Were all novels like those of madame de Crousaz, Mrs. Inchbald, miss Burney, or Dr.Moore, she would adopt the name of novel with delight: But so much folly, errour, and vice are disseminated in books classed under this denomination, that it is hoped the wish to assume another title will be attributed to feelings that are laudable, and not fastidious.""",,
8,zeluco.jpeg,Zeluco,image/jpeg,Dr.Moore is mentioned by Edgeworth as the inspiration for Dr.X---. He is identified here among the authors Edgeworth admired because of their tendency to write novels that were in some way either instructive or emulative of elevated virtue/morality.,John Moore,The link provided offers a digitized copy of the primary source.,1789,1789,Novel,Authorship; Contemporary Works; Moral,https://bc.primo.exlibrisgroup.com/permalink/01BC_INST/1nm9l4s/alma99117718180001021,Maria Edgeworth,3,"""Were all novels like those of madame de Crousaz, Mrs. Inchbald, miss Burney, or Dr.Moore, she would adopt the name of novel with delight: But so much folly, errour, and vice are disseminated in books classed under this denomination, that it is hoped the wish to assume another title will be attributed to feelings that are laudable, and not fastidious.""",,
9,stanhope.jpeg,Letters…to his Son,image/jpeg,"It is uncertain the precise inspiration of this name, however these letters from Philip Stanhope (Earl of Chesterfield) were addressed to his son offering advice and instruction on moral and social subjects, much as Mrs. Stanhope attempts to do for Belinda to much less beneficial effect. This contrast was likely deliberate, in that the contradiction highlights the distinct lack of guidance Mrs.Stanhope provides so much as orders for her will to be done.",Philip Stanhope,The link provided offers a digitized copy of the primary source.,1774,1774,Correspondence; Non-fiction,Literary Culture; Moral,https://bc.primo.exlibrisgroup.com/permalink/01BC_INST/1nm9l4s/alma99124890780001021,Narrator,7,"""Mrs. Stanhope, a well-bred woman, accomplished in that branch of knowledge, which is called the art of rising in the world, had, with but a small fortune, contrived to live in the highest company.""",,
10,lock.jpeg,The Rape of the Lock,image/jpeg,"Potential inspiration for the name of the titular character of this novel, like the heroine of this poem and Lord Geroge Lyttleton's Advice to a Lady. In this mock-epic, Belinda is outraged at her suitor for cutting and absconding with a lock of her hair--based on a similar incident that happened in real life. There is a scene in which Lady Delacour suggests that Clarence do the same with a lock of novel Belinda's hair, pointing to the reliability of this assumed source of inspiration--along with Belinda's subsequent distancing from any such infringements on her personal integrity. [See the reference to the same primary source, from page 70 of the novel for more information.]",Alexander Pope,The link provided offers a digitized copy of the primary source.,1714,1714,Poetry,Contemporary Works; Literary Culture; Epic; Satire,https://bc.primo.exlibrisgroup.com/permalink/01BC_INST/1nm9l4s/alma99117846300001021,Narrator,7,"""One niece still remained unmarried--Belinda Portman, of whom she was determined to get rid of with all convenient expedition.""",,
11,advicetolady.jpeg,Advice to a Lady,image/jpeg,"In later editions of Advice to a Lady by Lyttleton, the poem was entitled ""To Belinda"" and placed next to Monody--the latter of which also serves as the Epigraph to this novel. There is reasonable speculation that Edgeworth conceived of the novel's character Belinda based on two examples of poems about genteel young women named Belinda and courtship: The Rape of the Lock, by Alexander Pope, and this work by Lyttleton. Additionally, Belinda's last name ""Portman"" might suggest ""portmeanteau""--in other words, a collection of her qualities and attractions, as outlined by this poem (459).",Lord George Lyttleton,The link provided offers a digitized copy of the primary source.,1733,1733,Poetry,Contemporary Works; Literary Culture; Moral,https://bc.primo.exlibrisgroup.com/permalink/01BC_INST/1nm9l4s/alma99119470140001021,Narrator,7,"""One niece still remained unmarried--Belinda Portman, of whom she was determined to get rid of with all convenient expedition.""",,
12,advicetolady.jpeg,Advice to a Lady,image/jpeg,"Mrs. Stanhope invokes a line within this poem, which at large endeavors to speak the ""truth"" about the nature and origins of feminine vanity, and how it is counterproductive to the cultivation of a honest and sensible (in line with the contemporary definition, prudent) love in women: “What is your Sex’s earliest, latest Care, / Your Heart’s supreme Ambition? To be fair; / For this the Toilet every Thought employs, / Hence all the Toils of Dress, and all the Joys : / For this Hands, Lips, and Eyes are put to School, / And each instructed Feature has its Rule.” Mrs. Stanhope attempts to inculcate within her nieces an aspect of this mindset; in which every quality/talent/asset of the person is marsheled to establish themselves in high society--more specifically, to marry a wealthy man of considerable status--just as it is represented here in the service of vain attraction. This is contradictory to Lyttleton's overall message about how women are raised to be captivating on a surface level, rather than expressing beauty as something that comes from within: “Her fairest Virtues fly from publick Sight, / Domestick Worth, that shuns too strong a Light...Thus, I, Belinda, would your Charms improve, / And form your Heart to all the Arts of Love.” The foreshadowing inherent in this allusion by Edgeworth signals the true nature of the novel's narrative aims, which is to create a heroine of the same name who wins her romantic love match through bold prudence and humility--not through the excessive vanity and wit of fashion witnessed in Lady Delacour. This also gives considerable insight into Mrs.Stanhope's mind, in that she believes it is exactly this aspect of Lady Delacour that will be an asset to Belinda's social advancement, revealing her short-sighted and ultimately poor advice when it comes to choosing a partner solely on the basis of immediate financial gain.",Lord George Lyttleton,"The phrases referenced can be found on page 4 of the primary source document, spanning lines 21-22.",1733,1733,Poetry,Contemporary Works; Literary Culture; Moral,https://bc.primo.exlibrisgroup.com/permalink/01BC_INST/1nm9l4s/alma99119470140001021,Narrator,7,"""'For this, hands, lips, and eyes were put to school, / And each instructed feature had it's rule.'""",,
13,richard3.jpeg,Richard III,image/jpeg,"An inventive re-imagining of a scene from Richard III, in which the brother he has had imprisoned--named Clarence--is asked by his keeper (whom Lady Delacour plays on this impromptu stage) the nature of the bad dreams that he mentions with no shortage of distress. Clarence then goes on to describe his haunting recollection, rendered by the novel's Clarence as a way to convey the displeasure with which he felt his visit at Mrs.Luttridge's house. The comparison is apt, considering Mrs.Luttridge is proven to be every bit as calculating and ruthless as Richard III; revealed especially in the chapter regarding her E O table, which she uses to swindle countless high society men out of enormous sums of money.",William Shakespeare,"With reference to Act 1, scene 4, which begins at the bottom of page 23 and continues on to page 25.",1734,1734,Play,Theater; Literary Culture; History; Tragedy,https://bc.primo.exlibrisgroup.com/permalink/01BC_INST/1nm9l4s/alma99119452890001021,Lady Delacour; Clarence Hervey,13,"""'What was your dream, my lord, I pray you tell me?'"" ""'O lord, methought what pain it was to dance! / What dreadful noise of fiddles in my ears! / What sights of ugly belles within my eyes! / --- Then came wandering by, / A shadow like a devil, with red hair, / Dizened with flow'rs; and she bawl'd out aloud, / Clarence is come, false, fleeting, perjur'd Clarence!'""",,
14,penseroso.jpeg,Il Penseroso',image/jpeg,"Here Lady Delacour cleverly plays on the line from this famous poem: ""Sometimes let gorgeous Tragedy / In sceptered pall come sweeping by."" In the primary source, the speaker conveys a sincere wish to behold the goddess Melancholy in all of her majesty, and in this section speaks of staying up all night for just a glimpse of her passing. Marriott's insistent association of tragedy with Lady Delacour--whose sole aspiration in life is to disguise the extent of her true feelings of unhappiness and illness from the world, yet unknown to the reader--as well as Lady Delacour's subsequent allusion could be considered an adroit form of foreshadowing on Edgeworth's part. Marriott, as her waiting-woman, would be one of the people closest to Lady Delacour, and so her ability to reveal things that are not evident to the social world (which is how Mrs. Stanhope understands and communicates Lady Delacour's sensibility to Belinda) is significant.",John Milton,The phrase referenced by Lady Delacour can be found at the top of page 19 in the primary source document.,1751,1751,Poetry,Literary Culture; Ode,https://bc.primo.exlibrisgroup.com/permalink/01BC_INST/1nm9l4s/alma99106892090001021,Lady Delacour,19,"""O yes, you [Belinda] must be the comic muse; and I [Lady Delacour] must be tragedy, because Marriott has a passion for seeing me 'come sweeping by.'""",,
15,penseroso.jpeg,Il Penseroso',image/jpeg,"Further allusion is made to this poem in the same scene where Belinda and Lady Delacour are preparing for the masquerade, referring to the lines: ""'In sage and solemn tunes have sung, / Of tourneys and of trophies hung, / Of forests and enchantments drear, / Where more is meant than meets the ear'"" regarding Lady Delacour's uncharacteristic submission to Marriott's will. These lines from the primary source suggest some awe-inspiring power in the goddess of Melancholy's imbued influence on music, and in much the same way the narrator remarks upon Marriott exposing a similar sensibility in Lady Delacour that the latter desperately tries to hide.",John Milton,The phrase referenced by the narrator can be found in the middle of page 20 in the primary source document.,1751,1751,Poetry,Literary Culture; Ode,https://bc.primo.exlibrisgroup.com/permalink/01BC_INST/1nm9l4s/alma99106892090001021,Narrator,19,"""There was an air of extreme vexation in lady Delacour's countenance, as she pronounced these last words, in which evidently more was meant than met the ear.""",,
16,epithalamion.jpeg,Epithalamion,image/jpeg,"Among the earliest uses of the literary phrase ""proud humility,"" here Spenser is describing a bride newly married on her wedding night. The inherent innocent virtue within this description is somewhat at odds in its juxtaposition with Lady Delacour in this moment, except perhaps for a shared sense of heightened vulnerability.",Edmund Spenser,"The line ""proud humility"" can be found in the middle of page 205 in the primary source document.",1594,1594,Poetry,Literary Culture; Ode,https://bc.primo.exlibrisgroup.com/permalink/01BC_INST/1nm9l4s/alma99102371520001021,Belinda,19,"""For some time, Belinda imagined that this submission was merely an air, as she had seen some other fine ladies proud of appearing to be governed by a favourite maid; but she soon was convinced, that Marriott was no favourite with lady Delacour; that her ladyship's was not proud humility, but fear.""",,
17,allswell.jpeg,All's Well That Ends Well,image/jpeg,"With reference here to the way Helen describes the subject of her romantic love, Bertram: “His humble ambition, proud humility; / His jarring concord; and his discord dulcet."" What is of particular note in this section of the play is the way in which her descriptions are progressively inverted here, and the content of her replies to Parolles seems to be intentionally trying to distract him from the true nature of her feelings by remaining vague and contradictory. Bertram, much like Lady Delacour, is a rather willful person of significant power; he rejects Helen's romantic feelings for him several times on the basis of her class before he can be convinced to be with her by the end of the play. Belinda here, in all of her shrewd perception, notices that it is not Lady Delacour simply indulging Marriott's demands--which would not be entirely unexpected from her penchant for raillery, despite being willful by nature--but rather that she is obeying Marriott for some other reason.",William Shakespeare,"The line ""proud humility"" can be found in Act 1, scene 1, on page 9 of the primary source document.",1756,1756,Play,Theater; Literary Culture; Comedy,https://bc.primo.exlibrisgroup.com/permalink/01BC_INST/1nm9l4s/alma99122107240001021,Belinda,19,"""For some time, Belinda imagined that this submission was merely an air, as she had seen some other fine ladies proud of appearing to be governed by a favourite maid; but she soon was convinced, that Marriott was no favourite with lady Delacour; that her ladyship's was not proud humility, but fear.""",,
18,widow.jpeg,The Irish Widow,image/jpeg,"This was a well-known play at the time, and much novelty was associated with the 'breeches' role taken up by actress Mrs. Barry. One would be remiss to not to notice the way both Harriot Freke and Lady Delacour, in their imitation of the character, are being exemplified as fashionable members of London high society. As this precedent is also set to establish the reader's understanding/expectations of Harriot Freke, it is apt that the main character does act outrageously and later dresses as a man to ward off an unwanted suitor. Harriot Freke does all of these things, but instead of trying to chase unwanted affections away in a comedic way, she implements these qualities for the sake of maintaining constant social relevance and manipulating other vain individuals vulnerable to her machinations.",David Garrick,The link provided offers a digitized copy of the primary source.,1772,1772,Play,Theater; Contemporary Works; Comedy,https://bc.primo.exlibrisgroup.com/permalink/01BC_INST/1nm9l4s/alma99110468160001021,Lady Delacour,20,"""Harriot Freke has told him, in confidence, that I'm to be the widow Brady, in man's clothes; now that's to be Harriot's own character, so Hervey will make fine confusion.""",,
19,paradise.jpeg,Paradise Lost,image/jpeg,"May be pointing to this description of Adam and Eve: ""So hand in hand they passed, the loveliest pair / That ever since in loves imbraces met, / Adam the goodliest man of men since born / His sons, the fairest of her daughters Eve."" There are two notable impilcations to this description of his failed serpent costume for the masquerade; the first and most obvious one being that he is being aligned with all of the virtues and appeal of Adam rather than Lucifer in the form of the snake. His costume fails literally and symbolically because he does not have the capacity to be maliciously manipulative or deceptive to the extent witnessed in Lucifer, even despite his capacity for social adaptation. The added observation that ""nothing remained but the melancholy spectacle of [the serpent's] skeleton"" further implies that Clarence's adherence to vanity is entirely mechanical, not the driving force of his mind and personality like Harriot Freke (21). The second implication is that, in invoking this harmonious scene between Adam and Eve in the midst of this mishap, there is the suggestion that he will be--and indeed he is--the central, successful male love interest for Belinda.",John Milton,"This excerpt can be found in book 4, spanning lines 321-324.",1667,1667,Poetry,Literary Culture; Epic; Moral,https://bc.primo.exlibrisgroup.com/permalink/01BC_INST/1nm9l4s/alma99138106893301021,Narrator,21,"""[Clarence] had contrived a set of phosphoric rays, which he was certain would charm all the fair daughters of Eve.""",,
20,schools.jpeg,The School for Scandal,image/jpeg,"Clarence and his friend group are laughing about the men ensnared by Mrs.Stanhope's attempts at pairing her nieces with wealthy husbands, and Belinda--in the costume of the tragic muse, then assumed to be Lady Delacour--is the only one who stands apart by sighing. In accordance with their usual penchant for exchanging witty banter, Clarence plays up what he thinks is feigned dejection by commending her capacity to withhold laughter despite the clearly comedic topic of conversation. (This particular play was a comedy, likely known to inspire a considerable deal of laughter.)",Richard Brinsley Sheridan,The link provided offers a digitized copy of the primary source.,1780,1780,Play,Theater; Contemporary Works; Comedy,https://bc.primo.exlibrisgroup.com/permalink/01BC_INST/1nm9l4s/alma99121585890001021,Clarence Hervey,23,"""'Even were she at the School for Scandal, the tragic muse dare not laugh, except behind her mask,' said Clarence Hervey.""",,
21,essayonman.jpeg,Essay on Man,image/jpeg,"This may be an allusion to the lines ""Mean-while Opinion gilds with varying rays / Those painted clouds that beautify our days; / Each want of happiness by Hope supply'd / And each vacuity of sense by Pride."" This reference is significant in that it seeks to highlight how this particular character (Sir Philip) is so prideful as to cloud his good judgment (sense). Over the course of the novel the reader observes how this foible is sustained in his efforts to court Belinda at the expense of Clarence's clear feelings for her, and her subsequent lack of interest in his suit.",Alexander Pope,"This excerpt can be found in Epistle 2, lines 283-286, spanning pages 37-38 in the primary source document.",1733,1733-1734,Poetry,Contemporary Works; Literary Culture; Moral,https://bc.primo.exlibrisgroup.com/permalink/01BC_INST/1nm9l4s/alma99101354910001021,Sir Philip Baddely,23,"""'Damn me, if I know any woman, young or old, that would avoid being married, if she could, though, damn me.' cried sir Philip Baddely, a gentleman who always supplied 'each vacuity of sense' with an oath--'But damn me, Rochfort, didn't Valleton marry one of those nieces?'""",,
