objectid,filename,title,format,interpretation,creator,findingaid,date,date_expanded,category,subject,url,speaker,pageref,citedtext,rights,rightsstatement
74,lock.jpeg,The Rape of the Lock,image/jpeg,"The 'glittering forfex' referred to here means a pair of scissors, which were used to remove a lock of hair from the main character of the same name, Belinda, by her suitor. As this novel was based in some measure on this poem by Pope, this line is likely satirical; the novel's Belinda was in no such danger of indelicacy the same way the woman of the poem was. That being said, the original poem in and of itself was an exaggeration of a real life event based in the classical literary tradition--and therefore suggests that Belinda's subsequent retreat was one based in appropriate conduct of the time, even if she was in no actual danger of personal invasion.",Alexander Pope,"This line is featured in the final pages of Canto 3, on page 27 of this primary source.",1714,1714,Poetry,Contemporary Works; Literary Culture; Epic; Satire,https://bc.primo.exlibrisgroup.com/permalink/01BC_INST/1nm9l4s/alma99117846300001021,Narrator,70,"""Fortunately for Belinda, 'the glittering forfex' was not immediately produced, as fine ladies do not now, as in former times, carry any such useless implements about with them.""",,
75,comus.jpeg,Comus,image/jpeg,"Despite Lady Delacour's persistent raillery, Belinda show little to no discomposure after her guardian lets down her hair for Clarence to behold--and insists on cutting part of it for him to have as a keepsake. This has explicit romantic overtones, and yet throughout the course of these events Belinda--though taken by surprise--merely retreats from the situation quietly in accordance with her guiding precept of prudence above all else. Of particular note in the reference made here is ""unblench'd"", which can mean undismayed/unflinching or it can mean untarnished. Both definitions have merit here, in that Lady Delacour is commenting both on Belinda's unflinching composure throughout her attempts to judge whether or not Belinda has any interest in Clarence, but also on the nature of her unchanged by the notion of romantic love in any form. More time proves that Belinda likely feels a great deal for Clarence, which Lady Delacour discovers and draws out over the final chapters of the novel. Furthermore, in the context of the primary source, this invulnerability to romantic overtures--labeled chastity--is characterized as an armor akin to steel, which takes on significant meaning towards the end of this book. Largely because Lady Delacour comments on the fact that, while Belinda is guarded in a way that benefits her socially and in attempts at courtship, it is a heavy armor that also hinders her ability to honestly acknowledge and follow her own feelings (293-294).",John Milton; Henry John Todd,"The phrase Lady Delacour mentions here is line 430 in this primary source document, featured on page 66.",1798,1798,Poetry,Literary Culture; Masque,https://hdl.handle.net/2027/nyp.33433057515466,Lady Delacour,70,"""Such was the modest, graceful dignity of miss Portman's manners, that she escaped without even the charge of prudery--She retired to her own apartment as soon as she could. 'She passes on in ""unblenched majesty""'--said lady Delacour.""",,
76,ssc.jpeg,She Stoops to Conquer,image/jpeg,"Another instance of Lady Delacour's sense of raillery, Lady Delacour here is speaking to the differences by which the phrase tete-a-tete can be received; in which it can simply be a neutral one-on-one conversation, or something that might have more romantic overtones. No doubt she is remarking on Clarence's sense of hushed urgency, and senses that it might be about Belinda given the way he requests his audience with her. This moment speaks to the aplumb by which both understand and display the importance of social graces during this cultural moment.",Oliver Goldsmith,"With reference to Act 2, in which Mrs. Hardcastle hints at this alternative meaning of the phrase on page 26 of this primary source.",1773,1773,Play,Theater; Contemporary Works; Literary Culture; Comedy,https://bc.primo.exlibrisgroup.com/permalink/01BC_INST/1nm9l4s/alma9999175040001021,Lady Delacour,70,"""'I am never at leisure,' interrupted lady Delacour, 'but if you have any thing particular to say to me, as I guess you have, by--my skill in human nature--come here to my concert, to night, before the rest of the world--wait patiently in the music room, and perhaps I may grant you a private audience.--As you had the grace not to call it a tete-a-tete.'""",,
77,iliad.jpeg,Iliad,image/jpeg,"Lady Delacour compares her capacity for recall with Iris as conveyed in Alexander Pope's translation of the Iliad, in which the goddess delivers a message to King Priam from Zeus with impressive exactness. A familiar iteration of her characteristic raillery, Lady Delacour here is commenting on how Clarence's description of Belinda suggests deeper feelings on his part and tries to draw out more detail on the precise nature of those feelings, both to accurately convey what he wants (in line with Iris) but also to create her own conclusions about his attraction. Of note also is that the message Iris delivers is not one of poor tidings and speaks of Zeus' desire to guide them through unharmed, and in this way one might also perceive the parallel of Lady Delacour's earnest wish to bring them together, and that her designs to communicate on each other’s behalf are benevolent as proven by the end of the novel.",Homer; Alexander Pope,"The section of the Iliad Lady Delacour refers to here is in Book 24, likely with reference to Iris message to King Priam starting on line 207-225, spanning pages 154-155 in the primary source document.",1715,1715-1720,Poetry,Contemporary Works; Literary Culture; Translation; Epic; Global Literature; Classics,https://bc.primo.exlibrisgroup.com/permalink/01BC_INST/1nm9l4s/alma99123604190001021,Lady Delacour,71,"""'Stay,' interrupted lady Delacour, 'let me get it by heart--I should have made a terrible bad messenger of the gods and goddesses, for I never in my life could, like Iris, repeat a message in the same words in which it was delivered to me.--Let me see--""Dignity of mind, and simplicity of character,"" was not it?'""",,
78,chaplet.jpeg,The Chaplet,image/jpeg,"Here Clarence refers to a well-known song composed by Moses Mendez, in which one stanza proclaims: “You say at your Feet that I wept in Despair, / And vow’d that no Angel was ever so fair ; / How could you believe all the Nonsense I spoke? / What know we of Angels—I meant it in joke.” The implication within the song is that Damon's praises to Laura were made without great significance, that they were words of flattery and not commitment. Inherent in Clarence's reply to Lady Delacour is that perhaps he does perceive Belinda to be an angel in all of the benevolent and romantic implications of that word, but his fear is that any hastened remark of passion will be received as a sign of surface level or insincere flattery. Lady Delacour instantly perceives the depth of his feelings in this cautious approach, and this moment serves as one of the subtle but numerous instances in which Clarence's regard for Belinda is revealed between the lines. Belinda, furthermore, proves to be exactly of this mind: in that when Clarence attempts to engage her with familiar ease, her sense of prudence wins out and she does not take his overtures seriously.",Moses Mendez,"The part of the song referenced here is in Act 1 Scene 1, in the middle of page 4 of this primary source document.",1749,1749,Play,Theater; Contemporary Works; Literary Culture; Comedy,https://bc.primo.exlibrisgroup.com/permalink/01BC_INST/1nm9l4s/alma99111461890001021,Lady Delacour; Clarence Hervey,71,"""'May I not say at once, ""My dearest Belinda, Clarence Hervey desires me to tell you, that he is convinced you are an angel?""--That single word angel is so expressive, so comprehensive, so comprehensible, it contains, believe me, all that can be said or imagined on these occasions, de part et d'autre.' 'But,' said Mr.Hervey, 'perhaps miss Porrtman has heard the song of--""What know we of angels, / I meant it in joke.""'""",,
79,cobham.jpeg,"Epistle to Richard Temple, Viscount Cobham'",image/jpeg,"The narrator's observations in this line mimic the end of Pope's poem: “And you! Brave Cobham, to the latest breath / Shall feel your ruling passion strong in death : / Such in those moments as in all the past, / ‘Oh, save my country, heav’n!’ shall be your last.” Allegedly friends, Pope expressed admiration for Viscount Cobham in this piece, remarking on the inscrutability and inconstance inherent in most--but virtue is both singular and unshakeable in those whom it is cultivated. Pope's conviction here is that regardless of what anyone might say, the truth of Cobham's dedication to the preservation of his country will always win out. This allusion might be a subtle comment on the fact of Lady Delacour's emergent sense of virtue: that though she is often consumed with vanity as her most reliable trait, there is a clear sense here that it is merely performance to her. Her greatest interest, even long before she and Belinda are close, is that Clarence might one day serve as a suitable and loving husband to Belinda. Of important note as well is that when Lady Delacour quite literally is approaching her death bed before a risky surgery, among her wishes is that Belinda is left with some of her most expensive jewelry should she perish, explicitly stating that they are to be hers either to finance her independence, or worn with joy should she be married to ""an opulent husband"" (274). In much the same way as is remarked of Cobham, Lady Delacour to the last is dedicated to doing right by both Belinda and Clarence, and endeavors to bring them together to the benefit of both.",Alexander Pope,"This epistle to Viscount Cobham is the first of Pope's collection of four ethic epistles, and spans pages 5-15 in the primary source. The phrase referenced by Edgeworth here is found on the last page, line 264.",1750,1750,Poetry,Contemporary Works; Literary Culture; Moral,https://bc.primo.exlibrisgroup.com/permalink/01BC_INST/1nm9l4s/alma99120436430001021,Narrator,73,"""'What audacity!--don't you see these people coming in?' cried lady Delacour, and she withdrew her hand, but with no great precipitation: she was evidently 'at this moment, as in all the past' neither afraid nor ashamed, that Mr.Hervey's devotions to her should be paid in public. With much address she had satisfied herself as to his views, with respect to Belinda.""",,
80,kj.jpeg,King John,image/jpeg,"In the wake of Belinda's subdued distancing from Clarence following the razor strop comment at the masque and his subsequent request to Lady Delacour to help him return to Belinda's good graces, he procures the two fine horses she wants for their carriage--under the guise of providing Belinda only the best for her first appearance at court (in reality, assuaging Lady Delacour's vanity to have the most impressive entrance the day of). Because Belinda is not aware of Lady Delacour's underlying machinations and the promise she made to Clarence, her conduct remains in line with prudence; reserved and distant from him despite his overt efforts to smooth things over between them. In his frustration with what appears to be Lady Delacour and Belinda refusing to fulfill their end of the agreement, he refers to the efforts of King Philip II in this play to try to subdue the tensions of war between the English and the French via the marriage between the French crown prince and King John's niece Blanche, beseeching the papal legate to support his cause in sanctifying the union and avoiding conflict: “Unswear faith sworn, and on the marriage-bed Of smiling peace, to march a bloody host, And make a riot on the gentle brow Of true sincerity? O holy Sir, My reverend Father, let it not be so; Out of your grace, devise, ordain, impose, Some gentle order, and we shall be blest To do your pleasure, and continue friends"" (33). The most notable implication in this alignment suggests that Clarence perceives Belinda’s assumed displeasure with him on the same scale of a monarch wary of war looming on the horizon; while naturally Belinda is not disposed to conflict in the slightest, it does reveal the gravity with which he frets over the capacity to win her esteem. Despite his assurances that he has no interest in marriage and does not think of Belinda in that way quite yet, it is worthy of notice that he is fixated on winning her good will with surprising determination—that her cool acceptance of his presence when visiting the Delacours is insufficient to satisfy him. It is also not the only instance within the novel that he engages in some hyperbole when it comes to any sensitive territory with regard to Belinda, indicating the latent nature of his true admiration and passion for her in these sudden moments of uncharacteristic insistence. [See primary source: First Satire of the Second Book of Horace Imitated]",William Shakespeare,"Clarence's reference of a ""smiling peace"" can be found in Act 3 Scene 2 of the play, featured here on page 33 of the primary source document.",1735,1735,Play,Theater; Literary Culture; History,https://bc.primo.exlibrisgroup.com/permalink/01BC_INST/1nm9l4s/alma99116008740001021,Clarence Hervey,74,"""Clarence Hervey seemed to think, that her ladyship had not fulfilled her part of the bargain.--'Is not smiling,' said he, 'the epithet always applied to peace--yet I have not been able to obtain one smile from miss Portman since I have been promised peace.'""",,
81,tragicalrichard3.jpeg,The Tragical History of Richard the Third,image/jpeg,"Here Lady Delacour repeats a well-known line from Colley Cibber's version of Shakespeare's original play, Richard III: ""Richard's himself again"" spoken by the self-same character. Within context, Richard is assailed by terrible dreams of the fight to come, and endeavors to rally himself to the fight--this phrase is his attempt to encourage himself to continue onward and regain his courage. Shortly before this remark, Lady Delacour endeavors to persuade Belinda to treat Clarence with greater warmth in his visits, and when her displeasure ceases to have the effect intended, Lady Delacour returns to her approach of raillery and flattery which are her usual social strategies to bend circumstances in her favor. Thus, within the span of this short scene, Lady Delacour does ""become herself again"" quite literally.",William Shakespeare,"Colley Cibber's version of this play can be found from pages 301-372, featured right before the end of the second volume of this collection.",1777,1777,Play,Theater; Literary Culture; History,https://hdl.handle.net/2027/nyp.33433074908439,Lady Delacour,75,"""'Do you know, my dear, that I have been so ashamed of myself for this week past, that I have hardly dared to look you in the face.--I am sensible I was downright rude and cross to you one day--and ever since I have been penitent; and as all penitents are, very stupid and disagreeable, I am sure--but tell me you forgive my caprice, and lady Delacour will be herself again.'""",,
82,populartales.jpeg,Popular Tales,image/jpeg,"""Out of debt, out of danger"" was a popular proverb of the time, and the title of one of Maria Edgeworth's short stories in Popular Tales. These stories were originally conceived as dually instructive and entertaining tales, called ""popular"" with the express wish that moral tales might be available to people within lower social classes, who might not be able to find similar works at their disposal with recent changes in printing practices. Though the phrase is somewhat misattributed here, in that Lady Delacour has not at all found herself out of debt and out of danger since she has persisted in her deception of Belinda, Clarence, and Lord Delacour--and therefore has not resolved the inherent wrong of her lie or secured the source of the two hundred guineas to pay for the horses.",Maria Edgeworth,"This particular short story starts on page 309-384, and marks the end of the first volume.",1804,1804,Prose fiction,Edgeworth's Corpus; Contemporary Works; Literary Culture; Moral,https://bc.primo.exlibrisgroup.com/permalink/01BC_INST/1nm9l4s/alma99133966850001021,Lady Delacour,76,"""Belinda smiled--'There now, one such smile as that for Clarence Hervey, and I am out of debt and out of danger,' said lady Delacour.""",,
83,tdd.jpeg,The Delicate Distress,image/jpeg,"Lady Delacour's titular allusion to this epistolary novel is a rather explicit commentary on her strained relationship with Lord Delacour, in that she expressly requested new horses from Clarence under the assumption that her husband would not provide them, at the expense of Belinda's continued trust in her. ""The Delicate Distress"", otherwise known as ""Two Novels. In Letters"" encompasses a woman's romantic tribulaitons--however in this case the trials are post-marital, reinforcing Lady Delacour's own pitiable situation in parallel.",Elizabeth Griffith,The link provided offers a digitized copy of the primary source.,1769,1769,Epistolary,Contemporary Works; Literary Culture; Matrimony,https://bc.primo.exlibrisgroup.com/permalink/01BC_INST/1nm9l4s/alma99110712230001021,Lady Delacour,76,"""'I'll take care Mr.Hervey shall know that,' said lady Delacour, 'but in the mean time, I do think any fair appraiser of delicate distresses would decide, that I am, all the circumstances considered, more to be pitied at this present moment that you are.--For the catastrophe of the business evidently is, that I must pay two hundred guineas for the horses some how or other.'""",,
84,caesar.jpeg,Julius Caesar,image/jpeg,"In this reference, Cassius reflects upon a time in which the waters of the Tiber River were especially tumultuous, and Caesar said: “Dar’st thou Cassius now, Leap in with me into this angry Flood, And swim to yonder point?” A notable parallel between these two scenes is that Caesar, like Clarence, ends up nearly drowning until Cassius helps him out of the water; unfortunately for Clarence, his friends do little to nothing to help him out of the water until Sir Percival notices his distress. Given Cassius' betrayal of Caesar's confidence shortly after this recollection, this might have been an act of foreshadowing with regard to the way that Clarence's friends actively act against his romantic suit and best interest when he no longer stays in their company.",William Shakespeare,"This line is found in Act 1 Scene 2, on page 9 of this version of the primary source a fourth of the way down the page.",1711,1711,Play,Theater; Literary Culture; History,https://bc.primo.exlibrisgroup.com/permalink/01BC_INST/1nm9l4s/alma99123623370001021,Clarence Hervey,83,"""'You may wink at one another, as wisely as you please,' said Clarence, 'but come on my boys--I am your man for a swim--a hundred guineas upon it--""Darest thou, Rochfort, now, / Leap in with me into this weedy flood, / And swim to yonder point,""'""",,
85,franklin.jpeg,Experiments and Observations in Electricity…to which are added Letters and Papers on Philosophical Subjects,image/jpeg,"Benjamin Franklin, in a larger collection of his scientific and philosophical works, truly does try to teach a friend (a Mr. O. N.) how to swim in one of his letters. Despite the perceived nonsense in Clarence's assumption that reading about how to swim would automatically enable him to learn how to swim in the real world, the notion is not entirely absurd in that Franklin does go into significant detail as to how to slowly develop the skill throughout his letter: “I Cannot be of opinion with you that ’tis too late in life for you to learn to swim…[learn] what is called the stroke, or that manner of drawing in and striking out the hands and feet that is necessary to produce progressive motion” (463). Furthermore, Franklin actually does acknowledge the difference between knowing and being able to do something, in reference to the difficulty of entrusting to the somewhat natural buoyancy that comes with swimming: “though we value ourselves on being reasonable knowing creatures, reason and knowledge seem on such occasions to be of little use to us” (465). Clarence’s impetuousness and desire to impress his friends seems to be the greater part of his mistake here, alongside a misattribution of what he’s read to real life. This, also, has its echoes in the unformed nature of his youth evident in his reading Rosseau and misguided attempt to fulfill his maxims through Virginia as a result—which he discovers was just as unwise and and dangerous a course of action.",Benjamin Franklin,"In the expanded fourth edition, the letter on swimming is number 55, and spans pages 463-468. Franklin also wrote an essay entitled ""The Art of Swimming"", which goes into even further detail and evokes his note in the letter calling for the establishment of swimming schools as an important skill.",1769,1769,Non-fiction,Contemporary Works; Literary Culture,https://bc.primo.exlibrisgroup.com/permalink/01BC_INST/1nm9l4s/alma99123358610001021,Clarence Hervey; Narrator,83,"""'I am your man for a swim'…and instantly Hervey, who had in his confused head some recollection of an essay of Dr. Franklin's on swimming, by which he fancied that he could ensure at once his safety and his fame, threw off his coat and jumped into the river--luckily he was not in boots.""",,
86,random.jpeg,The Adventures of Roderick Random,image/jpeg,"Likely with reference to Tobias Smollett's novel, which was--during the time of Edgeworth's writing--falling out of popularity due to a perception that it was too immoral and vulgar. It is all too fitting then, that a character equally prone to vice and open indelicacy would tout a work written by himself as worthy of the same renown as this particular book. There is also something to be said regarding his rather empty boast in Rochfort's rejoinder than Sir Philip Baddely need not fear his reflection on the page given he doesn't bother to read. Also a humorous metatextual moment, in that despite his resistance to the notion of being ""[written] down in black and white"" Edgeworth is portraying him in all of his vacuity regardless (85). This is among the rare moments in which Sir Philip Baddely almost seems to approach the foolishness of his own actions, but ultimately avoids facing them or doing anything to grow out of them unlike Clarence.",Tobias Smollett,The link provided offers a digitized copy of the primary source.,1748,1748,Novel,Contemporary Works; Literary Culture; Picaresque,https://bc.primo.exlibrisgroup.com/permalink/01BC_INST/1nm9l4s/alma99105282470001021,Sir Philip Baddely,85,"""'You're a famous fellow, faith, to want to see yourself in print--I'll publish this in Bond street--damn it, in point of famousness, I'd sport my Random against all the books that were ever read or written, damn me--but what are we doing here?'""",,
87,macbeth.jpeg,Macbeth,image/jpeg,"With reference to the famous opening lines of MacBeth's soliloquy, one might perceive this to be a sign of Clarence's yet lingering fecklessness, in that one can easily perceive this as a manifestation of his making light of a near-death experience; MacBeth says the same under the perception that to fight on will mean certain death, and that he will have died for nothing. In much the same way, Clarence nearly died for nothing but vanity and social acceptance. It is no coincidence, then, that Dr.X-- attempts to persuade him to dine with the Percivals rather than his friends, with concern for his health after such a taxing incident on his body. Though Clarence only quotes the most famous phrase, the rest is particularly pertinent to a full understanding of the sentiment evoked: “And all our yesterdays have lighted fools / The way to dusty death. Out, out, brief candle! / Life’s but a walking shadow, a poor play / That struts and frets his hour upon the stage, / And then is heard no more! It is a tale / Told by an idiot, full of sound and fury, / Signifying nothing!” There is the suggestion that, should Clarence continue in this folly bereft of virtue, his life too will be one that will eventually end without meaning.",William Shakespeare,"The featured soliloquy is in Act 5, Scene 5, on page 65 of this copy of the play.",1734,1734,Play,Theater; Literary Culture; Tragedy,https://bc.primo.exlibrisgroup.com/permalink/01BC_INST/1nm9l4s/alma99124545720001021,Clarence Hervey,86,"""'But as I (Clarence) cannot submit to your unjust charge of humility, will you tell me where you are to be found in town, and to morrow'--'to morrow--and to morrow--and to morrow'""",,
