objectid,filename,title,format,interpretation,creator,findingaid,date,date_expanded,category,subject,url,speaker,pageref,citedtext,rights,rightsstatement
41,delicacy.jpeg,False Delicacy,image/jpeg,"Lady Delacour is likely referring the way in which Lady Betty Lambton in the play is too humble to confess the extent of her feelings for Lord Windworth and subsequently appears to lose him to another woman (before the end of the play)--thus evoking a sense of false delicacy. High fashionable London society does appear to have some disdain toward excessive displays of virtue and humility--as seen in Lady Delacour's persistent raillery of Belinda's general sense of reserve. Lady Delacour notes that she had initially perceived Harriot Freke with a level of trepidation as to her ""impudence"", but after this conduct attracted no shortage of social intrigue Lady Delacour felt the need to ""reform [her] manners"" to ensure she would not be levied with the moritifying accusation of false delicacy herself (40).",Hugh Kelly,"The moment in which the moral of the play is revealed (the ultimate virtuous merit of false delicacy) in Act 5, from pages 80-87 In the primary source document.",1768,1768,Play,Theater; Contemporary Works; Comedy,https://bc.primo.exlibrisgroup.com/permalink/01BC_INST/1nm9l4s/alma99116302440001021,Lady Delacour,41,"""'I found it necessary to reform my manners. If I had not taken heart of grace, and publicly abjured the heresies of false delicacy, I should have been excommunicated--Lady Delacour's sprightly elegance--allow me to speak of myself in the style in which the newspaper writers talk of me.'""",,
42,toalady.jpeg,To a Lady',image/jpeg,"A reference to Pope's description of Calypso: ""'Twas thus Calypso once our hearts alarm'd, / Aw'd without virtue, without Beauty charm'd / Her Tongue bewitch'd as oddly as her Eyes, / Less Wit than Mimic, more a Wit than Wife, / Strange Graces still, and stranger Flights she had, / Was just not ugly, and was just not mad; / Yet never so sure our passion to create, / As when she touch'd the brink of all we hate."" There are several points of intrigue here, each of which foreshadowing a great deal of Mrs. Freke's chracterization. From her erratic and haphazardous behavior, to the intentional way that she capitalizes upon the weakness of others. For example, how she uses Juba's superstitious nature against him as well as attempts to persuade Belinda against the virtue inherent in the Percivals' lifestyle--reducing it to boring worthlessness. Much of her ability to deceive Lady Delacour was in her deliberate manipulation of the former's vanity and desperation for social belonging. Calypso as a figure herself is also an evocative extrapolation, in that the name itself means to ""conceal,"" and the reader discovers just how much Mrs. Freke conceals from both Lady Delacour and others in general: her initial introduction into the text was the deliberate prank played on Hervey regarding who was dressed as the widow Brady. Furthermore, Mrs. Freke hides the way in which she leads Colonel Lawless to believe Lady Delacour wanted to separate from Lord Delacour and be his lover instead, resulting in the calamitous duel for her honor. The particular line ""less wit than mimic"" is also rather powerful here, in that Mrs. Freke turns out to be unable to hold her own against Sir Percival in a debate about the inherent value of virtue, signalling the fact that she is more prone to copy fallacious, surface level arguments without a real substantive justification to add to any serious discussion about what constitutes virtue.",Alexander Pope,"The relevant lines in this poem span 45-52, and can be found on page 8.",1735,1735,Poetry,Contemporary Works; Literary Culture; Moral,https://bc.primo.exlibrisgroup.com/permalink/01BC_INST/1nm9l4s/alma99118085650001021,Lady Delacour,41,"""'[Mrs.Freke] had the talent of making the world believe that virtue to be invulnerable by nature, which disdained the common outworks of art for it's defence. I, amongst others, took it for granted, that the woman who could make it her sport to 'touch the brink of all we hate,' must have a stronger head than other people.""",,
43,vicar.jpeg,The Vicar of Wakefield,image/jpeg,"With direct reference to Ephraim Jenkinson, who intentionally deceives his audience that he is a learned man via his repeated explication of cosmogony. While Lady Delacour speaks ill of Lord Delacour here, there is a contradictory element to this comparison; in that Lord Delacour turns out to be right about how negative an influence Mrs. Freke was on both of their honor as a result of entangling Colonel Lawless into their affairs.",Oliver Goldsmith,"In both volumes, the first mention of this habit in Ephraim is in volume 1, chapter 14 (bottom of page 129) and in volume 2, chapter 5 (pages 79-80).",1766,1766,Novel,Contemporary Works; Literary Culture; Moral,https://bc.primo.exlibrisgroup.com/permalink/01BC_INST/1nm9l4s/alma99110887330001021,Lady Delacour,41,"""'The league of amity between [Lady Delacour and Mrs. Freke] was scarcely ratified, before my lord Delacour came with his wise remonstrating face, to beg me 'to consider what was due to my honor and his.'--Like the cosmogony-man in the Vicar of Wakefield, he came out over and over with this cant phrase, which had once stood him in stead.'""",,
44,hamlet.jpeg,Hamlet,image/jpeg,"Lady Delacour repeats part of Hamlet's lines: ""O! it offends me to the Soul, to hear a robustous Perriweg pated Fellow tear a Passion to very Rags, to split the Ears of the Groundlings; who, for the most part, are capable of nothing but inexplicable dumb Shews and Noise: I would have such a Fellow whipp'd for o'er doing it Termagant; it out-Herods Herod. Pray you avoid it."" Here he is advising the player not to overdo his acting, and in much the same way Lady Delacour means to imply that Mrs. Freke took the mockery of her concerns to a whole new level as she was acting the part of friend in her overt manipulation.",William Shakespeare,"This excerpt can be found in Act 3, scene 2, and can be found on page 46.",1757,1757,Play,Theater; Literary Culture; Tragedy,https://bc.primo.exlibrisgroup.com/permalink/01BC_INST/1nm9l4s/alma99118252500001021,Lady Delacour,41,"""'But to return to my friendship for Harriot Freke. I, of course, repeated to her every word which had passed between my husband and me. She out-Heroded Herod upon the occasion; and laughed so much at what she called my folly in pleading guilty in the Lawless cause, that I was downright ashamed of myself, and purely to prove my innocence, I determined, upon the first convenient opportunity, to renew my intimacy with the colonel.'""",,
45,caesar.jpeg,Julius Caesar,image/jpeg,"Here Lady Delacour references Cassius' famous phrase: ""Men at some times are Master of their Fates: The Fault, dear Brutus, is not in our stars, But in our selves, that we are Underlings."" Of interest here is the preface to this line, in that Lady Delacour's reformation is central to her character--and is something that she chooses for herself with the help of Belinda, in the aftermath of Mrs. Freke's betrayal and the worsening of her chest wound. Much of Lady Delacour's dissolution is something that she herself perceives as inevitable, although there are aspects of it that were exacerbated by both her and her husband's vices. Furthermore, here Cassius can be seen as taking on something of Mrs. Freke's aim, in that he tries to bolster Brutus as equal to Caesar in order to overthrow the latter, which is mirrored in Mrs. Freke's elevation of Lady Delacour leading to the death of Colonel Lawless.",William Shakespeare,"This excerpt is from Act 1, scene 2, and can be found on page 10 of this document.",1711,1711,Play,Theater; Literary Culture; History,https://bc.primo.exlibrisgroup.com/permalink/01BC_INST/1nm9l4s/alma99123623370001021,Lady Delacour,42,"""'Lawless, as my stars (which you know are always more at fault than ourselves) would have it, returned just at this time from the continent, where he had been with his regiment;'""",,
46,times.jpeg,Times,image/jpeg,"In this newspaper article both Lady Wallace and Mrs. Inchbald were reported to attend the House of Commons ""in breeches""; of particular note also is the advertisement of The Irish Widow on the first page, a comic play which capitalizes on the humor inherently perceived with regard to a woman in breeches role.",?,"This article was published on March 6, 1788, Issue 880306. ISSN: 0140-0460",1788,1788,Article,Current Events; Theater,https://link.gale.com/apps/doc/CS16909926/TTDA?u=mlin_m_bostcoll&sid=bookmark-TTDA&xid=723c3530,Harriot Freke,43,"""'Where do you think I've been?' said Harriot, 'in the gallery of the House of Commons; almost squeezed to death these four hours; but I swore I'd hear Sheridans' speech tonight, and I did--Betted fifty guineas I would, with Mrs. Luttridge, and have won.'""",,
47,misc.jpeg,"Miscellaneous Pieces, in Prose",image/jpeg,"At the time Germany was associated (in terms of perception) with the most sensationalized Gothic novels, which were regarded with some concern by English society due to the subject matter and content. Lady Delacour's comparison here collapses the sense of trepidation and horror evoked by the German Gothic tradition with the visage of old woman Mrs.W--- in the doorway. Mrs.W-- was likely supposed to represent the famous astrologer in the 1790s, a Mrs. Williams, who ""specialized in advice to young women of the nobility and gentry on their marriage prospects"" (469). Lady Delacour, likely knowing this, characterizes her purposefully as an ominous omen to Colonel Lawless' dangerous conclusions about their love (or lack thereof) life.",John and Anna Laetitia Aiken (later Barbauld),Sir Betrand a Fragment' starts on page 127-137.,1773,1773,Story Collection,Contemporary Works; Literary Culture; Gothic,https://bc.primo.exlibrisgroup.com/permalink/01BC_INST/1nm9l4s/alma99111645810001021,Lady Delacour,44,"""'As the old woman and her miserable blue light went on before us, I could almost have thought of sir Bertrand, or of some German horrifications, but I heard Lawless, who never could help laughing at the wrong time, bursting behind me, with a sense of his own superiority.'""",,
48,heiress.jpeg,The Heiress,image/jpeg,"With reference to the conversation within the play: “Dear Lady Emily, don’t you doat upon folly?” “To extacy. I only despair of seeing it well kept up.” Miss Alscrip alludes to there being no danger to excessive vanity, which Lady Emily heartily denies is without risk. Lady Delacour's allusion here serves as a moment of self-awareness, likely in the wake of potential divorce and social ruin.",John Burgoyne,"Specifically with mention to a conversation between Miss Alscrip and Lady Emily in Act 3, scene 2, found on page 58 of the primary source.",1786,1786,Play,Theater; Contemporary Works; Literary Culture; Comedy,https://bc.primo.exlibrisgroup.com/permalink/01BC_INST/1nm9l4s/alma99116021510001021,Lady Delacour,45,"""'Well, my dear, I am in a hurry to have done with all this: though I 'doated upon folly,' yet I was terrified at the thoughts of any thing worse. The idea of a divorce, the public brand of a shameful life, shocked me, in spite of all my real and all my assumed levity'""",,
49,bulls.jpeg,Essay on Irish Bulls,image/jpeg,"Edgeworth and her father created a collection of comedic statements known as bulls--otherwise known as logically absurd or inconsistent statements (469). Harriot's usage of the phrase here hardly carries the same levity, in that she more or less admits to manipulating the circumstances to ensure Colonel Lawless would get the wrong idea about their shared time together, and leaves he and Lady Delacour alone to the repercussions of perceived improrpriety--which indeed prove to be disastrous to both of their lives/reputations.",Richard Lovell and Maria Edgeworth,The link provided offers a digitized copy of the primary source.,1802,1802,Story Collection,Edgeworth's Corpus; Contemporary Works; Literary Culture; Comedy,https://bc.primo.exlibrisgroup.com/permalink/01BC_INST/1nm9l4s/alma99104012320001021,Lady Delacour,46,"""'My friend the colonel is much obliged to me, I'm sure, for remembering what the cunning, or the knowing woman told us just now, that [Lady Delacour and Colonel Lawless]--or are to be--one and the same person. So when I said I left you alone, I was not guilty of a bull, was I?'""",,
50,anecdotes.jpeg,More Last Words of Dr Johnson: Consisting of Important and Valuable Anecdotes,image/jpeg,"After Lady Delacour narrowly escapes what she perceives to be a dangerous attempt to claim her hand away from Lord Delacour, both she and Harriot Freke (the latter for appearance's sake) are determined to distance themselves from Colonel Lawless to ensure no further suggestions that he will pursuit his suit. At the time of Samuel Johnson's death he remained in the public consciousness long after, and so this allusion by Lady Delacour may yet imply the duel to come and the way in which Colonel Lawless' death impacted her life long after the duel ended.",Francis Barber,The link provided offers a digitized copy of the primary source.,1787,1787,Novel,Contemporary Works; Literary Culture; Satire,https://bc.primo.exlibrisgroup.com/permalink/01BC_INST/1nm9l4s/alma9998632220001021,Lady Delacour,46,"""'My esteemed friend agreed with me, that it would be best for both parties concerned to hush up this business; that as Lawless was going out of town in a few days, to be elected for a borough, we should get rid of him in the best way possible, without ""more last words""'""",,
51,ane.jpeg,Arabian Nights Entertainments,image/jpeg,"With reference to the princess Scheherazade of One Thousand and One Nights, who told stories each night in order to stave off certain death at the hands of her ruler husband. This allusion perhaps serves as foreshadowing for the very real mortality Lady Delacour feels while revealing the nature of her chest wound to Belinda, and the distress that this level of vulnerability causes her.",Charles Wheeler,"There is no clear edition referenced, and a version was selected within the time frame that would be a plausible source for Edgeworth in the time of her writing (late eighteenth century).",1777,1777,Story Collection,Global Literature; Literary Culture; Translation,https://bc.primo.exlibrisgroup.com/permalink/01BC_INST/1nm9l4s/alma99122693580001021,Lady Delacour,47,"""Turning to Belinda with a forced smile, she said--'Now shall the princess Scheherazade go on with her story?'""",,
52,tdn.jpeg,The Dying Negro,image/jpeg,"Here Lady Delacour references a well-known abolitionist poem, in which the central character is a formerly enslaved black person who takes their own life, based in real life events. The part of the work she references speaks to the character's wish not to bring sadness to the people around him: “When pleasure led thee o’er the smiling plain, / Ere, like some hell-born spectre of dismay, / I cross’d thy path, and darken’d all the way…the friendless victim of despair!” While one might attribute this comparison to inappropriate hyperbole, there is something to be said about Lady Delacour's consciousness and avoidance of the real anguish she caused lady Lawless following the death of her son.",John Bicknell; Thomas Day,"Relevant lines to this interpretation can be found on page 3, from 37-40.",1773,1773,Poetry,Abolition; Contemporary Works; Literary Culture; Current Events,https://bc.primo.exlibrisgroup.com/permalink/01BC_INST/1nm9l4s/alma99121359980001021,Lady Delacour,48,"""'That was lady Lawless--I believe I didn't answer you at the time.--I meet her every now and then--to me a spectre of dismay.'""",,
53,henry41.jpeg,Henry IV Part I,image/jpeg,"Lady Delacour is likely referring to the conversation between King Henry and his son, in which the king expresses sharp disapproval for the prince's dissipation and tendency towards vice. In his upbraiding, he notes the way that he had managed to rise to his station in the quiet cultivation of virtue by contrast to his son's self-indulgent sense of fame: “Had I so lavish my presence been, / So common-hackney’d in the eyes of men, / So stale and cheap to vulgar company” he would never have won the people's admiration and risen to the throne. Considering this allusion is made with reference to fashionable English society and the fathomless speed by which different cultural fixations and modes of conduct would go in and out of vogue, it is an apt comparison. It conveys a sense that Harriot Freke, like the prince, will do anything at all to stay relevant and feel seen--even if it means resorting to foolishness or cruelty.",William Shakespeare,"The excerpt referenced here can be found in Act 3, scene 2--at the top of page 58 in the priamry source document.",1751,1751,Play,Theater; Literary Culture; History,https://bc.primo.exlibrisgroup.com/permalink/01BC_INST/1nm9l4s/alma99108922190001021,Lady Delacour; Harriot Freke,50,"""'I scarcely thought her in earnest, till she added, that the only way left, nowadays, for a woman to distinguish herself, was by spirit; as every thing else had grown ""cheap and vulgar in the eyes of men.""'""",,
54,duelist.jpeg,The Female Duelist,image/jpeg,"Although The Female Duelist bears the closest resemblance to the non-existent treatise Lady Delacour mentions here, the novel suggests that it was in fact written by Clarence Hervey. Most likely in line with his attempts at sustaining social intrigue, the England of this time period had already begun to disapprove of duels between men, and a duel between women would be at best rare if not unheard of. Harriot Freke using Clarence's writings as justification for the perceived--and entirely fabricated--call for female duelling within public opinion only further reveals the premeditation and multi-layered conception of her scheme.",?,The link provided offers a digitized copy of the primary source.,1793,1793,Play,Theater; Contemporary Works; Literary Culture; Comedy,https://bc.primo.exlibrisgroup.com/permalink/01BC_INST/1nm9l4s/alma99100983490001021,Lady Delacour,50,"""'That she knew one of the cleverest young men in England, and a man of fashion into the bargain, who was just going to publish a treatise ""Upon the Propriety and Necessity of Female Duelling;"" and that he demonstrated beyond a possibility of doubt, that civilized society could not exist a half a century longer without this necessary improvement.'""",,
55,rivals.jpeg,The Rivals,image/jpeg,"In this popular comedic play, the character evoked here--Bob Acres--is a reluctant participant in a duel, and exclaims: “Sir Lucius—I doubt it is going—yes—my valour is certainly going!—it is sneaking off!—I feel it oozing out as it were at the palms of my hands!” This parallel is entirely befitting Lady Delacour's situation, in that Harriot Freke devised the duel deliberately to play with her friend's life for her own amusement (being in league with Mrs. Luttridge and fully aware of the disparity in their skills, as well as a pattern of this type of heedless behavior towards others). It is Harriot Freke that suggests the duel in the first place, who incites her to issue the challenge despite penning it with a shaking hand, and who readily furnishes Lady Delacour with male attire, weapons, and a second under the guise of fulfulling the social expectations of a ""lady of fasion"" demanded of Lady Delacour's reputation. Like Bob Acres, Lady Delacour ultimately becomes an unwilling and frightened participant.",Richard Brinsley Sheridan,"Lady Delacour's quoted line is reflected in Act 5, scene 3, on page 94 of this primary source document.",1775,1775,Play,Theater; Contemporary Works; Literary Culture; Comedy,https://bc.primo.exlibrisgroup.com/permalink/01BC_INST/1nm9l4s/alma99104077010001021,Lady Delacour,51,"""'In the evening, Harriot and I rode to the ground. There were several bullets sticking in the posts of the barn:--this was the place where Mrs.Luttridge had been accustomed to exercise herself in firing at a mark. I own my courage ""oozed out"" a little at this sight.'""",,
56,gnomologia.jpeg,"Gnomologia: Adagies and Proverbs; Wise Sentences and Witty Sayings, Ancient and Modern Foreign and British, collected by Thomas Fuller",image/jpeg,"Here Lady Delacour is likely referencing the proverb: “Many would be Cowards if they had Courage enough.” Her application of the phrase is somewhat questionable in that, as her courage waned, she realized that there was ultimately no good reason for her to engage in the duel to begin with--but felt the social pressure to continue ""on a point of honour with [her] spirited second"" (51). Lady Delacour is cowardly in this scene, then, on two levels: the first in her inability to acknowledge and act in accordance to her own reason (signalling that this fight was dangerous and pointless), the second in risking her life for the sake of social acceptance. The latter flaw puts this scene in conversation with Clarence's near-drowning, revealing the extent to which--though these two characters are highly rational and capable individuals--they also commit grave errors for the sake of fitting into fashionable society. Edgeworth, on some level, may be commenting on the harmful excesses of this type of vice inherent in and stoked by parts of London society.",Thomas Fuller; Francois duc de la Rochefoucauld,"In this collection of adagies and proverbs, Lady Delacour's reference can be found under number 3366.",1732,1732,Non-fiction,Contemporary Works; Literary Culture,https://bc.primo.exlibrisgroup.com/permalink/01BC_INST/1nm9l4s/alma99125369360001021,Lady Delacour,51,"""'The duke de Rochefoucault, I believe, said truly, that ""many would be cowards if they dared.""'""",,
57,bard.jpeg,The Bard,image/jpeg,"""Lion-port"" or ""lyon-port"" as it appears in Thomas Gray's ode entails a boldness of demeanor. The entire line that features the phrase reads as follows: “Her eye proclaims her of the Briton-Line; / Her lyon-port, her awe-commanding face, / Attemper’d sweet to virgin-grace.” Given the conveyance of the term here, one can assume Lady Delacour recites Harriot Freke's descriptor verbatim; which might explain why the allusion is so poorly rendered. On a surface level there are similarities in Lady Delacour being English, and the phrasing is likely evocative of Freke's attempt at flattery by elevating her friend's sense of courage--but Lady Delacour mentions on several occasions just how rattled and nervous she was about participating in the duel as the time drew near. This disharmony between them as friends, and what was probably Freke entirely ignoring the signs of Lady Delacour's dismay and unperturbed encouragement of the dangerous duel, signal that in all likelihood Freke never considered Lady Delacour a friend in the true sense of the term. And in accordance, Freke does not understand the gravity by which the ode constructs the image of a figure at once bold and yielding, which does paradoxically reflect Lady Delacour's reformation towards the end of the novel in some ways.",Thomas Gray,"This description can be found in canto 3 verse 2 of ode two, at the bottom of page 19.",1757,1757,Poetry,Contemporary Works; Literary Culture; Ode,https://bc.primo.exlibrisgroup.com/permalink/01BC_INST/1nm9l4s/alma99118047710001021,Lady Delacour; Harriot Freke,51,"""'Harriot was in admiration of my ""lion-port:"" to do her justice, she conducted herself with great coolness upon the occasion; but then it may be observed, that it was I who was to stand to fire, and not she.'""",,
58,horace.jpeg,"The Satires, Epistles, and Art of Poetry of Horace Translated into English Prose",image/jpeg,"With reference to Horace's insistence in the primary source that tragedy and comedy must remain disparate literary approaches, Lady Delacour contradicts this standard maxim. Her invocation of tragicomedy being the reflection of a ""true representation of what passes in the world"" does perhaps signal Edgeworth's conviction that formal realism must include both to achieve a convincing sense of the genre, as this particular novel is distinctive in its capacity--and arguably Lady Delacour's versatile expression--of both.",Horace; ?,"Evidence of Horace's conviction can be found on page 498: “Thus it is certain, that Tragick Verse ought not to be used in Comedy, nor Comick in Tragedy.”",1743,1743,Prose fiction; Poetry; Non-fiction,Literary Culture; Classics; Translation; Global Literature; Satire,https://bc.primo.exlibrisgroup.com/permalink/01BC_INST/1nm9l4s/alma99121362910001021,Lady Delacour,53,"""'Life is a tragicomedy!--Though the critics will allow no such thing in their books, it is a true representation of what passes in the world; and of all lives, mine has been the most grotesque mixture, or alternation, I should say, of tragedy and comedy.'""",,
